id,title,abstract
pub.1120645205,Affordable Broad Agile Farming System for Rural and Remote Area,"We develop a fast-deployed crop health monitoring system using state-of-the-art technologies to collect data from crop fields in order to take appropriate and timely actions. For the proposed resource optimized system, Saudi Arabian agriculture is taken as a case study. To achieve the desire goals, we harness IoT (Internet of Things) and drones in agriculture to establish rapid system deployment. This paper focuses on the data collection from crop field by organizing heterogeneous IoT devices in clusters and localise them for data harvesting. Clusters are formed by considering the path of UAVs, sensors heterogeneity, weather conditions, fluctuation of sensor nodes, and the communication cost of IoT devices. For localisation, carrying larger or heavier arrays of antennas and receivers with a small size UAV is also a major issue considered in this paper. Hence, we introduce a dynamic clustering and virtual antenna array to develop a complete data collection scheme supported by simulations and experimental tests with proof-of-concept devices. The results are analysed and found promising in terms of energy efficiency, throughput, ease of use, and deployment time. Whole the system is developed with the concept that it can install in rural and remote area with minimum deployment time and agile enough that can collect data in worst conditions (bad weather, hostile environment, fluctuating nodes, poor infrastructure, with or without an established network). In broader sense it can map easily in many similar applications where data is needed to be harvested from a wide range of heterogeneous sensors without existing any infrastructure and ground topology."
pub.1155374293,Trend in Sustainable Mechanization of Indian Agriculture,"Agriculture is one of the most important sectors of the Indian economy contributing 18.5% of national income, about 15% of total exports and supporting two-thirds of the work force. At the same time, biotic and abiotic stresses, degrading and depleting land and water resources and climate change are major challenges for sustainable agricultural production and productivity. The small and marginal land holdings (less than 2.0 ha) account for more than 86% of land holdings. The labour availability in agriculture is expected to go down to 26% of total workforce by 2047. Mechanizing small and non-contiguous group of small farms is against ‘economies of scale’ for individual ownership of farm machinery. With no possibility of increase in net cultivated area and diminishing farm labour availability, intensive agriculture with higher input use efficiency is essential for the growth of Indian agriculture in near future. Farm power and agricultural machinery are essential inputs for sustainable agricultural production and productivity to feed India’s burgeoning population. The intensification of crop production must be sustainable with low environmental footprint. A holistic, value-chain approach is necessary for agricultural mechanization, going beyond green production  through precision agriculture and digital agriculture. Precision agriculture for region specific crop planning, controlled precision application of inputs (seeds, fertilisers, chemicals, water, etc), multi-functional farm equipment to conserve energy and to reduce turnaround time, application of drones in agriculture, application of sensors, micro-processor and computer in agriculture are some of the futuristic technologies that need more attention for sustainable agriculture in India. There is a need to simplify these technologies and make them cost-efficient for maximum adoption at the farmers’  level."
pub.1160583956,Evaluation of Unmanned Aerial Vehicles for Precision Agriculture Based on Integrated Fuzzy Decision-Making Approach,"The drone, also known as an unmanned aerial vehicle (UAV), offers significant advantages for precision agriculture by reducing the need for conventional farming practices that require more manpower. The use of drones in agriculture offers significant economic and time-saving benefits. The evaluation of UAVs’ performance is urgently needed in light of their proliferation in agriculture during the past few decades. This evaluation falls under the complex multicriteria decision-making (MCDM) problem due to the existence of multicriteria, criteria importance, and trade-offs or conflicts amongst them. Thus, the main purpose of this study is to offer an integrated fuzzy MCDM approach based on two significant methods. The first method is the fuzzy-weighted zero-inconsistency (FWZIC) method for calculating the UAV criteria (i.e., payload, endurance, and dimensions) weight coefficients. The second method is the fuzzy decision by opinion score method (FDOSM) for UAV alternative selection based on individual and group decision-making (GDM) settings. The decision matrix used in the selection approach of UAV categories is formulated based on the intersection of payload, endurance, and dimensions criteria and the UAV alternatives list. The findings show that (1) the FWZIC has effectively determined the criteria weights with a zero inconsistency rate. The maximum weight value is given to the payload criterion (0.428), whereas the dimension criterion was given the least value weight (0.199). (2) In the context of GDM, FDOSM is used to eliminate the dissimilarity between individual MCDM results across all categories of UAV. Finally, objective validation and sensitivity analysis were utilized to evaluate the strength of UAV selection results."
pub.1181837936,"Interplay of Intellectual Property Rights, Technological Innovation, and Sustainable Food Security: A Comprehensive Analysis","In the spectrum of new age challenges, the intersection and interplay of intellectual property rights in conjunction with innovation in technologies assisting sustainable food security indeed turned out to be a critical point for deliberation. This chapter intends to present a meticulous analysis of complex dynamics among these areas with the objective of unraveling the harmony, conflicts, and repercussions of plan of action. By delving into the historical factors and current trends, this chapter further deals with the influences and interconnections between intellectual property right issues and food security. Food security being one of the key human rights has evolved as a significant right in International Human Rights regime. The advancement of technologies in the domain of agriculture has substantially affected in myriad ways the security of food worldwide and it continues to change the dynamism. The study also furthers the research into transformative technologies including digital agriculture, biotechnology, modern farming methods, the use of robots and drones in agriculture, etc. This chapter also aims at analyzing the challenges related to and posed by Intellectual Property Rights amidst contemporary technological advancements. The study also presents various case studies enunciating the pragmatic intricacies of the concerned issue. By contemplating the insights from the legal framework and associated dimensions, this study comprehensively aims to contribute to proposing holistic solutions that could bring a balance between innovation and advancement with the paramount aim of harmonizing it with sustainability by fostering a balanced ecosystem and equitable availability of resources."
pub.1107389447,Drones-based sensor platforms,"Unmanned aerial vehicles (UAVs) or unmanned aerial systems (UAS), better known as drones, in a technological context are unmanned aircrafts that can be remotely controlled or fly autonomously. They work in conjunction with GPS and others sensors mounted on them. The total addressable value of drone-powered solutions in all applicable industries is significant – more than USD 127 billion, according to a recent PwC analysis. Drones have been mostly associated with military and warfare in the past but keeping pace with technological advancements, they have found application in a plethora of disciplines. With the world population projected to reach 9 billion by 2050 and agricultural consumption expected to increase by 70 percent over the same period, agri-producers need to embrace emerging technological advancements such as UAVs. Drones in agriculture are simply a low-cost aerial camera platform, equipped with an autopilot using GPS and sensors for collecting relevant data. They can be compared to a regular point-and-shoot camera for visible images, but whereas a regular camera can provide some information about plant growth, coverage and other things, a multispectral sensor expands the utility of the technique and allows farmers to see things that cannot be seen in the visible spectrum, such as moisture content in the soil, plant health, stress levels and fruits. These could help overcome the various limitations that hinder agricultural production. PwC estimates the potential market for drone-powered solutions in agriculture at USD 32.4 billion. UAVs application in agriculture opens the gateway to access real time information on the farm. It can be used at different stages throughout the cropping cycle"
pub.1155662990,ICT application for promotion of integrated farming system,"ICT is an umbrella term that includes communication devices like computer, mobile phone, radio, television, network hardware, satellite system etc. as well as services like audio and video call, text and multimedia messages. During first decade of twenty- first century, there had been spurt in experimentation of ICT in agriculture by the government, private, co-operative and non-government organizations (NGOs). The initiatives gave mixed result of success and failures. The initial challenges like lack of power back up, poor connectivity, high cost, lack of computer literacy and absence of digital content are disappearing at a faster rate. The growth in network infrastructure, cloud computing, decreasing price of computer and mobile phone and digital literacy have increased the internet access.  The present-day initiatives involve multiple channels like web, mobile app, SMS and IVR in multiple languages. At the same time the gamut of information has been increasing from crop specific information to value chain information. The emergence of social media has opened new vista for agricultural extension through which two-way information in multimedia format can be exchanged at virtually no cost.  These technologies can effectively be used for promotion of IFS. However, the response of research and extension system is not very encouraging. The extension professionals should gear up to develop technical competence and exposure so that content could be developed as per channel and in local language of the clients. The frontier technologies like sensor based diagnostic equipments, remote sensing and GIS, GPS technology as well as robotics and drone in agriculture are poised to change the landscape of agricultural extension."
pub.1158179367,Can Drones Help Smallholder Farmers Improve Agriculture Efficiencies and Reduce Food Insecurity in Sub-Saharan Africa? Local Perceptions from Malawi,"Smallholder farmers in sub-Saharan Africa play a vital role in achieving food security and nutrition, yet they are often overlooked by development policies and lack access to the technology and information needed to increase their agricultural productivity. This is particularly true in Malawi, where smallholder farmers make up over 80% of the population and face a range of risks and challenges, including vulnerability to climate change, that threaten their livelihoods, food security, and nutrition. While drones and precision agriculture technology have had a significant impact on agriculture in high-income countries, their application by smallholder farmers in low-income countries is not well understood. This study, conducted in 2022, examines how drones can assist smallholder farmers in increasing their agricultural productivity and food security in Malawi. It explores how smallholders perceive the use of drones and the potential benefits and limitations of using drones in their farming operations. A unique aspect of this study aims to understand smallholders’ perceptions of open data and data privacy. The results show that when smallholder farmers interact with drone data, they have a better understanding of their farm and are able to make more informed decisions that use fewer inputs and reduce production costs. Overall, this study demonstrates the potential for drones to assist smallholder farmers improve their on-farm knowledge, increase agricultural productivity, and mitigate the risks and challenges they face, leading to improved livelihoods and a more sustainable and secure food supply. Policymakers can promote the adoption of drone technology among smallholder farmers by developing policies that encourage public–private partnerships to create affordable, locally adapted drone technologies and programs that meet their unique needs, while also ensuring responsible use of drones in agriculture through regulations that address concerns about data privacy and security."
pub.1149579891,ECONOMIC EFFICIENCY OF DRONE USE IN AGRICULTURE,"The article analyzes the market of drones for agricultural activities as part of the concept of precision farming; the classification of agricultural drones by structure, use and cameras installed on them is given; the analysis of the world market of drones for today is carried out, and efficiency of introduction of drones in agriculture (on an example of plant growing) is calculated. To analyze the global market for agricultural drones, data were taken from analytical reports and reviews of companies such as: PricewaterhouseCoopers, Markets and Markets, Mordor Intelligence, Fortune Business Insider. The authors used the following research methods: observation method, index analysis, economic-mathematical modeling and deductive method for drawing conclusions. The study was conducted in several stages. First, the classification of drones by structure, use and type of video cameras was studied. At the second stage, on the basis of analytical reports of reputable international companies analyzed the current state of the agricultural drone market and its capacity; identified the prerequisites for the development of the agricultural drone market and the factors that have the greatest impact on the industry; the forecast on the future possible development of the agricultural drone market is analyzed, and the main market players are identified, indicating the country of origin of the companies. At the third stage, the analysis of the introduction of drone technology in crop production for aerial photography and fertilizer application was carried out. The article develops two possible scenarios of farmer's behavior in relation to agriculture: 1) monitor the condition of fields and crop growth with their own vehicle and apply fertilizers using specialized agricultural machinery; 2) perform similar work using drones. The average tariff for fertilizer application in Ukraine and the average salary of a drone operator were used for the calculation. Drones have been shown to be more cost-effective if they increase crop yields by more than 3.85% over five years of using the technology."
pub.1147273827,A Method of Encrypting the Traffic of Quadrocopters Through an A nalog Path During Monitoring of Agricultural Ground Objects,"The purpose of this work to developed a method for encrypting the traffic of quadcopters through an analog path throughout the monitoring of agricultural ground objects.  The use of unmanned aerial vehicles of a quadrocopter type for monitoring ground objects in agriculture is becoming more and more common practice and allows you to effectively solve a wide range of tasks. Technologically equipped drones in agriculture are capable of performing various monitoring operations, in particular: aerial photography, video filming, thermal filming, laser scanning, etc. Such monitoring makes it possible to assess the quality of crops and identify the fact of damage or death of crops, identify crop defects and problem areas, analyze the effectiveness of plant protection measures, check compliance with crop rotation plans, identify deviations and violations in the process of agrotechnical work, analyze the relief and create maps, conduct audit and inventory of land, carry out security measures and collect information for the security service, etc.  At the same time, drones are vulnerable to information attacks, which can be carried out for different purposes, in particular, to steal a drone, use it in a network of bots to attack other devices, or to intercept information that it collects for a device operator. All this necessitates the development of effective methods of information protection of drones from cyberattacks.  In this work, the Vernam cipher was used to encrypt the data, and a pseudo-random sequence generated using the Sinai mathematical billiard was used as the encryption key. Thus, an improved mathematical model for generating encryption keys based on the Sinai billiards has been proposed. On the basis of the proposed mathematical model, software was developed and working models of devices for conducting experiments were created. To create a layout, a module based on the STM32F103C8T6 microcontroller was selected, data between devices was transmitted via a radio module."
pub.1140511495,Drone RGB Images as a Reliable Information Source to Determine Legumes Establishment Success,"The use of drones in agriculture is becoming a valuable tool for crop monitoring. There are some critical moments for crop success; the establishment is one of those. In this paper, we present an initial approximation of a methodology that uses RGB images gathered from drones to evaluate the establishment success in legumes based on matrixes operations. Our aim is to provide a method that can be implemented in low-cost nodes with relatively low computational capacity. An index (B1/B2) is used for estimating the percentage of green biomass to evaluate the establishment success. In the study, we include three zones with different establishment success (high, regular, and low) and two species (chickpea and lentils). We evaluate data usability after applying aggregation techniques, which reduces the picture’s size to improve long-term storage. We test cell sizes from 1 to 10 pixels. This technique is tested with images gathered in production fields with intercropping at 4, 8, and 12 m relative height to find the optimal aggregation for each flying height. Our results indicate that images captured at 4 m with a cell size of 5, at 8 m with a cell size of 3, and 12 m without aggregation can be used to determine the establishment success. Comparing the storage requirements, the combination that minimises the data size while maintaining its usability is the image at 8 m with a cell size of 3. Finally, we show the use of generated information with an artificial neural network to classify the data. The dataset was split into a training dataset and a verification dataset. The classification of the verification dataset offered 83% of the cases as well classified. The proposed tool can be used in the future to compare the establishment success of different legume varieties or species."
pub.1169943242,Precision Agriculture: A Novel Approach on AI-Driven Farming,"One of these unusual countries with possible correlations is India. While maintaining our strong agrarian roots, we have advanced in technological terms. We do, meanwhile, wish to eliminate the gap that exists between our technological advancements and their uses in farming. Agriculture faces numerous obstacles when it comes to planning and harvesting. Farmers must formulate appropriate crops, starting with a study of the soils and land, fertilizer, seeding strategies, irrigation, pest control, monitoring for perfection, and ultimate harvesting. Inadvertent prepared plans no longer just reduce farmers’ profit margins but also undermine their livelihoods. For the first time in history, the Earth’s population will surpass eight billion by 2024, placing further strain on the world’s supply chain, which is already hampered by an unstable climate and a lack of water. Farmers are putting cutting-edge technological ideas into practice to meet future demands. For instance, IBM researchers are developing solutions that use cloud-connected devices, artificial intelligence (AI), and the Internet of Things (IoT) at every stage of the supply chain. In order to secure the security of the global supply, new IoT solutions are helping to monitor the health of beehives. Smart farming, robotic harvesters with AI-enhanced dexterity, diagnostic drones that can apply pesticides and fertilizer to rice fields, and other innovative technologies are also being used by farmers. In order to create and execute this plan, the farmers should accurately identify and assess their area. They can, however, be restricted by utilising the limited attainability and efficiency of guided surveying and surveillance. These regulations supply an upward push to making plans and projection errors, which develop into destiny losses. In order, drone-backed surveying, mapping, and surveillance tech are “ripe” for applications to fill this gap. Drones fill the gap in the analytics process. Elevated optical and thermal sensors can be carried by drones. Drones from Ideas Furnace can even carry both thermal and optical surveillance gear. This implies that each and every moment we fly they could perform more thorough and extensive surveys. Drones in agriculture are starting up new opportunities to boom their crop yield with higher farming applications and real-time access to information."
pub.1091514668,"GNSS Environmental Sensing, Revolutionizing Environmental Monitoring","This book is the second edition of Environmental Monitoring using GNSS and highlights the latest developments in global navigation satellite systems (GNSS). It features a completely new title and additional chapters that present emerging challenges to environmental monitoring—“climate variability/change and food insecurity.”  Since the publication of the first edition, much has changed in both the development and applications of GNSS, a satellite microwave remote sensing technique. It is the first tool to span all four dimensions of relevance to humans (position, navigation, timing and the environment), and it has widely been used for positioning (both by military and civilians), navigation and timing. Its increasing use is leading to a new era of remote sensing that is now revolutionizing the art of monitoring our environment in ways never imagined before. On the one hand, nearly all GNSS satellites (Global Positioning System (GPS), Glo bal Navigation Satellite System (GLONASS), Galileo and Beidou) have become operational, thereby providing high-precision, continuous, all-weather and near real- time remote sensing multi-signals beneficial to environmental monitoring. On the other hand, the emerging challenges of precisely monitoring climate change and the demand for the production of sufficient food for ever-increasing populations are pushing traditional monitoring methods to their limits. In this regard, refracted GNSS signals (i.e., occulted GNSS signals or GNSS meteorology) are now emerging as sensors of climate variability, while the reflected signals (GNSS reflectometry or GNSS-R) are increasingly finding applications in determining, e.g., soil moisture content, ice and snow thickness, ocean heights, and wind speed and direction, among others. Furthermore, the increasing recognition and application of GNSS-supported unmanned aircraft vehicles (UAV)/drones in agriculture (e.g., through the determination of water holding capacity of soil) highlights the new challenges facing GNSS. As such, this new edition three new chapters address GNSS reflectometry and applications; GNSS sensing of climate variability; and the applications in UAV/drones. Moreover, it explores the application of GNSS to support integrated coastal zone management."
